{
  "constraints": [
    "Preserve proven core logic.",
    "Prefer structured outputs and auditable traces.",
    "Do not rely on hidden reasoning as final evidence."
  ],
  "input_artifacts": [
    "runtime_state/local_short_term/orchestrator_bridge/BRIDGE-F4F1A3D8/legacy_scan_results.json"
  ],
  "produced_at": "2026-03-31T09:21:58.476392+00:00",
  "requested_agents": [
    "scanner_agent",
    "aggregation_agent",
    "backtest_learning_agent",
    "market_news_context_agent",
    "pm_planner_agent"
  ],
  "requested_market": "KOSDAQ",
  "run_context": {
    "as_of_date": "2026-03-31",
    "code_version": "bridge-v1",
    "created_at": "2026-03-31T09:21:58.476375+00:00",
    "market": "KOSDAQ",
    "model_version": "legacy",
    "run_id": "RUN-C8F3E0CD",
    "strategy_version": "legacy-ui-v1"
  },
  "task_id": "TASK-7081CF1D",
  "task_kind": "scan_pipeline",
  "user_request": "Run full scan pipeline from scanner bridge input and synthesize planner-ready outputs."
}