{
  "constraints": [
    "Preserve proven core logic.",
    "Prefer structured outputs and auditable traces.",
    "Do not rely on hidden reasoning as final evidence."
  ],
  "input_artifacts": [
    "runtime_state/local_short_term/scanner_agent/RUN-92EB994E/legacy_scan_results.json"
  ],
  "produced_at": "2026-04-01T14:10:54.684890+00:00",
  "requested_agents": [
    "scanner_agent",
    "aggregation_agent",
    "backtest_learning_agent",
    "market_news_context_agent",
    "pm_planner_agent"
  ],
  "requested_market": "AMEX",
  "run_context": {
    "as_of_date": "2026-04-01",
    "code_version": "orchestrated-us-research",
    "created_at": "2026-04-01T14:10:54.684859+00:00",
    "market": "AMEX",
    "model_version": "research-baseline",
    "run_id": "RUN-92EB994E",
    "strategy_version": "us-research-v1"
  },
  "task_id": "TASK-ADAC9CFF",
  "task_kind": "scan_pipeline",
  "user_request": "Run full non-UI scan pipeline for AMEX and produce planner-ready outputs."
}