{
  "constraints": [
    "Preserve proven core logic.",
    "Prefer structured outputs and auditable traces.",
    "Do not rely on hidden reasoning as final evidence."
  ],
  "input_artifacts": [
    "runtime_state/local_short_term/scanner_agent/RUN-FD3548E5/legacy_scan_results.json"
  ],
  "produced_at": "2026-04-01T14:35:44.149849+00:00",
  "requested_agents": [
    "scanner_agent",
    "aggregation_agent",
    "backtest_learning_agent",
    "market_news_context_agent",
    "pm_planner_agent"
  ],
  "requested_market": "AMEX",
  "run_context": {
    "as_of_date": "2026-04-01",
    "code_version": "amex-moonshot-cycle",
    "created_at": "2026-04-01T14:35:44.149828+00:00",
    "market": "AMEX",
    "model_version": "amex-research-baseline",
    "run_id": "RUN-FD3548E5",
    "strategy_version": "amex-moonshot-v1"
  },
  "task_id": "TASK-67FE2692",
  "task_kind": "scan_pipeline",
  "user_request": "Run full non-UI scan pipeline for AMEX and produce planner-ready outputs."
}