{
  "constraints": [
    "Preserve proven core logic.",
    "Prefer structured outputs and auditable traces.",
    "Do not rely on hidden reasoning as final evidence."
  ],
  "input_artifacts": [
    "runtime_state/local_short_term/orchestrator_bridge/BRIDGE-9EF6B00E/legacy_scan_results.json"
  ],
  "produced_at": "2026-04-07T22:49:19.921626+00:00",
  "requested_agents": [
    "scanner_agent",
    "aggregation_agent",
    "backtest_learning_agent",
    "market_news_context_agent",
    "pm_planner_agent"
  ],
  "requested_market": "KOSPI",
  "run_context": {
    "as_of_date": "2026-04-08",
    "code_version": "bridge-v1",
    "created_at": "2026-04-07T22:49:19.921596+00:00",
    "market": "KOSPI",
    "model_version": "legacy",
    "run_id": "RUN-7242D634",
    "strategy_version": "legacy-ui-v1"
  },
  "task_id": "TASK-13166B52",
  "task_kind": "scan_pipeline",
  "user_request": "Run full scan pipeline from scanner bridge input and synthesize planner-ready outputs."
}