{
  "constraints": [
    "Preserve proven core logic.",
    "Prefer structured outputs and auditable traces.",
    "Do not rely on hidden reasoning as final evidence."
  ],
  "input_artifacts": [
    "runtime_state/local_short_term/scanner_agent/RUN-26807BD7/legacy_scan_results.json"
  ],
  "produced_at": "2026-04-09T10:51:15.619272+00:00",
  "requested_agents": [
    "scanner_agent",
    "aggregation_agent",
    "backtest_learning_agent",
    "market_news_context_agent",
    "pm_planner_agent"
  ],
  "requested_market": "KOSPI",
  "run_context": {
    "as_of_date": "2026-04-09",
    "code_version": "non-ui-scan-v1",
    "created_at": "2026-04-09T10:51:15.619223+00:00",
    "market": "KOSPI",
    "model_version": "legacy",
    "run_id": "RUN-26807BD7",
    "strategy_version": "legacy-cli-v1"
  },
  "task_id": "TASK-8C51176A",
  "task_kind": "scan_pipeline",
  "user_request": "Run full non-UI scan pipeline for KOSPI and produce planner-ready outputs."
}