{
  "constraints": [
    "Preserve proven core logic.",
    "Prefer structured outputs and auditable traces.",
    "Do not rely on hidden reasoning as final evidence."
  ],
  "input_artifacts": [
    "runtime_state/local_short_term/orchestrator_bridge/BRIDGE-E3F937E5/legacy_scan_results.json"
  ],
  "produced_at": "2026-04-01T16:16:28.357633+00:00",
  "requested_agents": [
    "scanner_agent",
    "aggregation_agent",
    "backtest_learning_agent",
    "market_news_context_agent",
    "pm_planner_agent"
  ],
  "requested_market": "KOSPI",
  "run_context": {
    "as_of_date": "2026-04-02",
    "code_version": "bridge-v1",
    "created_at": "2026-04-01T16:16:28.357618+00:00",
    "market": "KOSPI",
    "model_version": "legacy",
    "run_id": "RUN-F6CB4E70",
    "strategy_version": "legacy-ui-v1"
  },
  "task_id": "TASK-66977B2E",
  "task_kind": "scan_pipeline",
  "user_request": "Run full scan pipeline from scanner bridge input and synthesize planner-ready outputs."
}