{
  "constraints": [
    "Preserve proven core logic.",
    "Prefer structured outputs and auditable traces.",
    "Do not rely on hidden reasoning as final evidence."
  ],
  "input_artifacts": [
    "runtime_state/local_short_term/scanner_agent/RUN-A0F6E3BA/legacy_scan_results.json"
  ],
  "produced_at": "2026-03-31T08:42:20.687064+00:00",
  "requested_agents": [
    "scanner_agent",
    "aggregation_agent",
    "backtest_learning_agent",
    "market_news_context_agent",
    "pm_planner_agent"
  ],
  "requested_market": "KOSDAQ",
  "run_context": {
    "as_of_date": "2026-03-31",
    "code_version": "non-ui-scan-v1",
    "created_at": "2026-03-31T08:42:20.687030+00:00",
    "market": "KOSDAQ",
    "model_version": "legacy",
    "run_id": "RUN-A0F6E3BA",
    "strategy_version": "legacy-cli-v1"
  },
  "task_id": "TASK-E954ADEC",
  "task_kind": "scan_pipeline",
  "user_request": "Run full non-UI scan pipeline for KOSDAQ and produce planner-ready outputs."
}